<?xml version="1.0" ?>
<!DOCTYPE experiment PUBLIC "-//systap.com//DTD BIGDATA EXPERIMENT 0.1//EN" "Experiment.dtd">
<!-- There are 20 conditions. -->
<experiment class="com.bigdata.cache.TestHardReferenceQueueWithBatchingUpdates">
 <defaults>
  <property name="capacity">8000</property>
  <property name="threadLocalNScan">0</property>
  <property name="units">SECONDS</property>
  <property name="timeout">10</property>
 </defaults>
 <!-- condition#1 -->
 <condition>
  <property name="threadLocalCapacity">16</property>
  <property name="nthreads">1</property>
  <property name="threadLocalTryLockSize">8</property>
 </condition>
 <!-- condition#2 -->
 <condition>
  <property name="threadLocalCapacity">16</property>
  <property name="nthreads">2</property>
  <property name="threadLocalTryLockSize">8</property>
 </condition>
 <!-- condition#3 -->
 <condition>
  <property name="threadLocalCapacity">16</property>
  <property name="nthreads">4</property>
  <property name="threadLocalTryLockSize">8</property>
 </condition>
 <!-- condition#4 -->
 <condition>
  <property name="threadLocalCapacity">16</property>
  <property name="nthreads">8</property>
  <property name="threadLocalTryLockSize">8</property>
 </condition>
 <!-- condition#5 -->
 <condition>
  <property name="threadLocalCapacity">16</property>
  <property name="nthreads">16</property>
  <property name="threadLocalTryLockSize">8</property>
 </condition>
 <!-- condition#6 -->
 <condition>
  <property name="threadLocalCapacity">32</property>
  <property name="nthreads">1</property>
  <property name="threadLocalTryLockSize">16</property>
 </condition>
 <!-- condition#7 -->
 <condition>
  <property name="threadLocalCapacity">32</property>
  <property name="nthreads">2</property>
  <property name="threadLocalTryLockSize">16</property>
 </condition>
 <!-- condition#8 -->
 <condition>
  <property name="threadLocalCapacity">32</property>
  <property name="nthreads">4</property>
  <property name="threadLocalTryLockSize">16</property>
 </condition>
 <!-- condition#9 -->
 <condition>
  <property name="threadLocalCapacity">32</property>
  <property name="nthreads">8</property>
  <property name="threadLocalTryLockSize">16</property>
 </condition>
 <!-- condition#10 -->
 <condition>
  <property name="threadLocalCapacity">32</property>
  <property name="nthreads">16</property>
  <property name="threadLocalTryLockSize">16</property>
 </condition>
 <!-- condition#11 -->
 <condition>
  <property name="threadLocalCapacity">64</property>
  <property name="nthreads">1</property>
  <property name="threadLocalTryLockSize">32</property>
 </condition>
 <!-- condition#12 -->
 <condition>
  <property name="threadLocalCapacity">64</property>
  <property name="nthreads">2</property>
  <property name="threadLocalTryLockSize">32</property>
 </condition>
 <!-- condition#13 -->
 <condition>
  <property name="threadLocalCapacity">64</property>
  <property name="nthreads">4</property>
  <property name="threadLocalTryLockSize">32</property>
 </condition>
 <!-- condition#14 -->
 <condition>
  <property name="threadLocalCapacity">64</property>
  <property name="nthreads">8</property>
  <property name="threadLocalTryLockSize">32</property>
 </condition>
 <!-- condition#15 -->
 <condition>
  <property name="threadLocalCapacity">64</property>
  <property name="nthreads">16</property>
  <property name="threadLocalTryLockSize">32</property>
 </condition>
 <!-- condition#16 -->
 <condition>
  <property name="threadLocalCapacity">128</property>
  <property name="nthreads">1</property>
  <property name="threadLocalTryLockSize">64</property>
 </condition>
 <!-- condition#17 -->
 <condition>
  <property name="threadLocalCapacity">128</property>
  <property name="nthreads">2</property>
  <property name="threadLocalTryLockSize">64</property>
 </condition>
 <!-- condition#18 -->
 <condition>
  <property name="threadLocalCapacity">128</property>
  <property name="nthreads">4</property>
  <property name="threadLocalTryLockSize">64</property>
 </condition>
 <!-- condition#19 -->
 <condition>
  <property name="threadLocalCapacity">128</property>
  <property name="nthreads">8</property>
  <property name="threadLocalTryLockSize">64</property>
 </condition>
 <!-- condition#20 -->
 <condition>
  <property name="threadLocalCapacity">128</property>
  <property name="nthreads">16</property>
  <property name="threadLocalTryLockSize">64</property>
 </condition>
</experiment>

